{
  "protocol_version": "0.4.0",
  "profile": {
    "id": "reservation-service-result",
    "version": "0.1.0"
  },
  "suite": {
    "id": "suite_reservation-service",
    "version": "0.1.0",
    "package_digest": "sha256:eeeeeeeeeeeeeeeeeeeeeeeeeeeeeeeeeeeeeeeeeeeeeeeeeeeeeeeeeeeeeeee"
  },
  "task": {
    "id": "task_repair-reservation-service",
    "version": "0.1.0"
  },
  "evaluator": {
    "id": "evaluator_reservation-service",
    "version": "0.1.0",
    "image_digest": "sha256:ffffffffffffffffffffffffffffffffffffffffffffffffffffffffffffffff"
  },
  "execution_contract": "workspace-snapshot/0.1.0",
  "outcome": {
    "status": "completed",
    "groups": {
      "validation": false,
      "cancellation": false,
      "idempotency": false,
      "concurrency": false
    },
    "passed_count": 0,
    "total_count": 4,
    "passed": false
  }
}
